//OUTPUT
//* Congestion Window Size = 1
//* 351	2.212271	15.0.1.2	15.0.1.1	TCP	54	49153 → 9 [ACK] Seq=122882 Ack=2 Win=65535 Len=0 TSval=2212 TSecr=2205

//* Congestion Window Size = 10
//* 351	2.189119	15.0.1.2	15.0.1.1	TCP	54	49153 → 9 [ACK] Seq=122882 Ack=2 Win=65535 Len=0 TSval=2189 TSecr=2182

//* Window Scaling (false)
//* 351	2.189119	15.0.1.2	15.0.1.1	TCP	54	49153 → 9 [ACK] Seq=122882 Ack=2 Win=65535 Len=0 TSval=2189 TSecr=2182

//* Window Scaling (true)
//* 351	2.189247	15.0.1.2	15.0.1.1	TCP	54	49153 → 9 [ACK] Seq=122882 Ack=2 Win=131072 Len=0 TSval=2189 TSecr=2182